식당명,작성일,방문횟수,리뷰 내용,리뷰 태그
건대 숯불부자곱창,6.2.월,1,"테이블 간격도 넓고 곱창집이 깔끔해서 더욱 믿음이 가더라구요. 곱창집은 다닥다닥 간격도 붙어 있고 시끄럽고, 심지어 깔끔하지 못한 집도 많은데 이 집은 굳굳굳! 심지어 의자도 편합니다. 생마늘 소곱창 1인분과 소곱창 1인분 주문했고 소곱창 다 먹은 뒤는 볶음밥으로 마무리했지요. 소곱창이 꼬들꼬들 식감도 좋고, 신선한 곱도 많아서 맛있어요! 무엇보다도 양도 대박많아서 정말 푸짐하게 먹었습니다^^","고기 질이 좋아요, 음식이 맛있어요, 잡내가 적어요, 재료가 신선해요, 매장이 넓어요"
건대 숯불부자곱창,5.30.금,1,"와 지나가다가 냄새가 너무 좋아서 들어갔는데
웬걸 너무 맛있어요… 안질기고 부드럽고 냄새 하나도 안나고 맛있습니다ㅜㅜ

그리고 다들 너무 친절하시고, 얼그레이 하이볼이 미친놈입미다 다른데랑은 다른 맛이니까 꼭꼭 드셔보세요ㅜㅜ 마늘소곱창+모듬 조합입니댜🖤

재방문의사 200% 앞으로 건대에서 소곱창은 여기로 하려구요 ㅎㅎ
접기","매장이 넓어요, 친절해요, 음식이 맛있어요, 잡내가 적어요, 비싼 만큼 가치있어요"
건대 숯불부자곱창,6.3.화,1,"검색해서 찾아왔어요! 소모둠으로 시켜서 먹었는데
진짜 인생 식당..💛 곱창 막창 대창 다 맛있어요 진짜로..🔥
전체적으로 매장 깔끔하고 다 구워져서 나와서
엄청 편하고 좋았습니다! 다음에 또 올게요! 🙌🙌
(+그리고 묵사발 꼭 드세요! 진짜 1개 시켰다가 2개 추가했어요)
접기","매장이 넓어요, 고기 질이 좋아요, 음식이 맛있어요, 친절해요, 매장이 청결해요"
건대 숯불부자곱창,6.6.금,1,"우연히 들어왔는데
마늘곱창 맛있게 먹었어요~~

곱창 안에 통마늘이 들어있는건데
곱 안에 곱이 적고 마늘만 있는거 아닌가 하는 합리적 궁금증이 있었어요~~

아이들이 아주 맛있게 먹었어요~~
치즈곱창도 궁금하네요~~~^^
접기","음식이 맛있어요, 인테리어가 멋져요, 매장이 청결해요"
건대 숯불부자곱창,5.29.목,2,"건대 사는데 늘 오는 곱창집은 여기뿐입니다
강추드려요 제일 맛집이에요🩷","음식이 맛있어요, 고기 질이 좋아요, 단체모임 하기 좋아요, 뷰가 좋아요, 야외공간이 멋져요"
건대 숯불부자곱창,5.31.토,1,"넓은 매장에 직원분들도 아주 친절한 곱창집이네요
곱창이 잡내도 없이 이주 맛있고 다른 곳 대비 가성비도 좋네요.
다시 방문하고 싶네요!","음식이 맛있어요, 잡내가 적어요, 매장이 넓어요, 친절해요, 매장이 청결해요"
건대 숯불부자곱창,6.3.화,1,"양대창이랑 소곱창 한끼뚝딱ㅎ
염통이 진짜 맛있어요!
밑반찬도 맛나고 소곱창 드시면 간,천엽도 1회 줍니당~","음식이 맛있어요, 고기 질이 좋아요, 반찬이 잘 나와요, 매장이 넓어요, 매장이 청결해요"
건대 숯불부자곱창,6.1.일,1,전에 왔는데 너무 맛있어서 또 방문했어요 건대 오면 무조건 와야 하는 곱창입니다!! 곱도 많고 직원분들도 너무 친절하세요 볶음밥 필수입니다 정말 맛있어요 🥺❤️,"음식이 맛있어요, 고기 질이 좋아요, 양이 많아요"
건대 숯불부자곱창,3.28.금,7,"곱창전골은 국물 맛이 깊고 진한 맛이 일품이에용!!
저는 음식 비린내에 예민한편인데 곱창도 신선하고 부드러워서, 먹을 때마다 입안에서 사르르 녹아요~~~~
맛 뿐만 아니라, 사장님께서 너무 친절하게 맞아주시는거같아용
이런 따뜻한 분위기 덕분에 더욱 기분 좋게 식사를
마칠 수 있는곳이에요! n번째 방문자의 리뷰이니 믿먹!!
정말 추천합니다!
접기","음식이 맛있어요, 고기 질이 좋아요, 양이 많아요, 가성비가 좋아요, 매장이 넓어요"
건대 숯불부자곱창,6.11.수,1,너무 맛있게 잘 먹고 가겠습니다!!! 미리 구워져서 나와서 편리해용 🥰🥰🥰 사장님도 너무 친절하세요 ㅎㅎ 다음에 또 올게요~~!!,"음식이 맛있어요, 고기 질이 좋아요, 친절해요, 매장이 청결해요, 직접 잘 구워줘요"
건대 숯불부자곱창,5.20.화,1,당일잡은.신선한 소곱창대창이라.쫄깃하고 신선함이 엄청납니다 😀 건강한소곱창 너무고소하네요,"음식이 맛있어요, 고기 질이 좋아요, 양이 많아요, 인테리어가 멋져요, 매장이 넓어요"
건대 숯불부자곱창,6.8.일,1,곱창도 너무 맛있구 직원분들도 너무 친절해요😍😍,"음식이 맛있어요, 고기 질이 좋아요, 양이 많아요, 특별한 메뉴가 있어요"
건대 숯불부자곱창,4.5.토,1,"곱이 꽉 차있는 멋진 곱창이었어요! 다른 부위도 다 맛있었구, 거의 다 구워서 나와서 냄새가 덜 배어 더 좋은 것 같습니당 가게 내부도 엄청 깔끔해요! 볶음밥을 주문했는데 고양이 모양이라 귀여웠습니다🐱 그리고 사장님이랑 직원분들이 다 너무 친절하셔요💌 다음에 또 올게요!!","친절해요, 매장이 청결해요, 직접 잘 구워줘요, 음식이 맛있어요, 고기 질이 좋아요"
건대 숯불부자곱창,4.13.일,2,"가게도 깨끗하고 사장님께서 친절히 해주셔서 너무 좋았어요! 직원분들도 잘해주셨고 무엇보다 곱창이 너무 맛있었습니다 😋 볶음밥도 너무 귀엽고 맛있었어요!
다음에 건대오면 또 들릴예정입니다~!!","음식이 맛있어요, 고기 질이 좋아요, 특별한 메뉴가 있어요, 매장이 넓어요"
건대 숯불부자곱창,4.18.금,1,ㅋㅋㅋㅋㅋ2인분 시키구 바로 소주..(처음엔 소맥으로 시작🥹)진짜 많은 곳의 소모둠을 시켜먹어봤지만 염통이 야들야즐하고 시간이 지나도 맛있는 곳을 본 적이 없어용! 여긴 알아서 소주안주…건대의 나이 상관없이 오길 바래용!!! 맛잇다!,"음식이 맛있어요, 고기 질이 좋아요, 가성비가 좋아요, 잡내가 적어요, 재료가 신선해요"
건대 숯불부자곱창,5.28.수,1,"매장 깔끔하고 야장분위기 구웃 맛도좋고
직원분들 친절해요","음식이 맛있어요, 고기 질이 좋아요, 양이 많아요, 특별한 메뉴가 있어요, 매장이 넓어요"
건대 숯불부자곱창,2.9.일,1,"소곱창 맛집 추가입니다.
매장이 넓고 편안한 느낌이예요.❤️
그래서 정말 내 집처럼 먹을 수 있는 느낌!
사장님 정말 친절하시고, 곱창맛 무엇(?)
곱창안에 마늘 들어가 있어서 느끼할 수 있는 느낌 확 잡아주네요. 정말 맛있어요ㅠㅠㅠ쫄깃하고 녹는듯한 느낌입니다.
여기 사진엔 못올렸지만 연예인들 많이 왔더라구요.
소곱창이 2마넌 안넘고, 가성비 좋구요!
맛도 있네요. 매장 넓고 편안하게 먹어서 너무 좋았어요.
번창하세요. 다음에 또 올께요! 맛나게 잘 먹었어요.💓
접기","음식이 맛있어요, 가성비가 좋아요, 잡내가 적어요, 단체모임 하기 좋아요, 직접 잘 구워줘요"
건대 숯불부자곱창,6.8.일,1,곱창 깔끔하고 냄새 안나요!! 늦게까지 열어서 새벽 1시 반 넘어서 왔는데도 사람들이 꽤 있었어요 ㅎㅎㅎ ̆̈,"매장이 넓어요, 음식이 맛있어요, 고기 질이 좋아요, 특별한 메뉴가 있어요"
건대 숯불부자곱창,5.21.수,1,곱창 잡내 없고 맛있어요 !! 볶음밥 고소해용 맛있게 잘 먹고 갑니다 😇,"고기 질이 좋아요, 잡내가 적어요, 매장이 넓어요"
건대 숯불부자곱창,4.27.일,1,"직원분이 너무 친절하셔요 사장님도 너무 친절하셨습니다 곱창도 눈으로 봐도 너무 질이 좋고요 맛있어요!
꼭 재방문 각입니다💗","음식이 맛있어요, 고기 질이 좋아요, 양이 많아요"
건대 숯불부자곱창,5.29.목,1,"소곱창 모둠 시켰는데 넘 맛있습니다@
건대 곱창 먹으러 오면 여기로 올려구요!
맛있어용❤️","음식이 맛있어요, 고기 질이 좋아요"
건대 숯불부자곱창,3.30.일,1,소곱창 먹고 싶어서 방문했는데 굉장히 맛있고 직원 분들이 친절하세요 초벌이 되어서 나와서 빨리 먹을 수 있기 때문에 만족스럽습니다 추천해요!,"매장이 넓어요, 친절해요, 음식이 맛있어요"
건대 숯불부자곱창,5.11.일,1,친구한테 추천받아서 왔는데 고기도 너무 맛있고 직원도 다들 친절하네요 곱창 금방금방 나와서 더 좋았어요!!! 건대 오면 또 올 것 같슴미당,음식이 맛있어요
건대 숯불부자곱창,2.14.금,1,"진-짜 맛있었어요
개인적으로 통마늘 곱창보단 일반 소곱창이 몇백배는 더맛있어요 볶음밥도 치즈추가안한게 맛있답니당(우리가족취향) 볶음밥 양 정말 많아유, 후식으로 곱창전골도 시켰는데 건더기 겁나 실해요 남편이랑 아빠가 너무맛있다고 전골만 먹으러도 재방문하시겠다하네요 ㅋㅋ
전부 조리되어 나와서 먹기 편했고 직원분들 바쁘신데엄청 친절해서 가족들이랑 정말 맛있게먹었습니다! 또 갈게요~~
접기","단체모임 하기 좋아요, 음식이 맛있어요, 고기 질이 좋아요"
건대 숯불부자곱창,5.3.토,1,"맨날 지나다니다가 리뷰 보고 너무 먹어 보고 싶어서 들어가서 먹었어요. 마늘 소곱창 1일 10인분 한정이라 써있길래 있을까 하고 시켰는데 7시에 가도 있더라고요. 마늘 소곱창 1인분, 소모둠 1인분 먹다가 나름 맛있길래 먹다가 키오스크 밑에 팻말로 소곱창 시키면 간천엽 서비스라고 하여서 시켰더니 정말 간천엽을 좋아하는 사람으로써 여기는 절대 먹지 마세요.. 먹다가 입맛 버리고 중간에 나와서 계산했고, 서비스인 줄 알았더니 계산 할 때 물어보니 달라고 말해야 준다고 합니다. 그럼 말해야 준다고 써두시던가요 ,, 모르고 시켰더니 서비스 양이랑 시키는 양이랑 달라서 뭐 해줄 수가 없다는 알바의 표정 보고 그냥 계산해달라 하고 나왔습니다. 곱창은 나쁘지 않지만 만약 가신다면 간천엽은 드시지 마세요 진짜.
접기","뷰가 좋아요, 야외공간이 멋져요"
건대 숯불부자곱창,5.31.토,1,건대에서 곱창으로 유명해서 왔는데 내부도 넓고 깨끗하고 곱창도 맛있어서 너무 좋았어요~!,"매장이 청결해요, 음식이 맛있어요, 고기 질이 좋아요, 매장이 넓어요, 아늑해요"
건대 숯불부자곱창,5.1.목,1,소곱창 돼지곱창 다 먹었는데 맛있어요~~,"음식이 맛있어요, 매장이 넓어요"
건대 숯불부자곱창,5.21.수,1,2인분인데 양도 실망이고 곱창이 고무같아요..심지어 곱이 없네요...리뷰에 속지말고 오지마세요ㅠㅠ,
건대 숯불부자곱창,6.3.화,1,너무 맛있어용 ㅎㅎ 다음에 또올게요,"음식이 맛있어요, 고기 질이 좋아요, 양이 많아요, 특별한 메뉴가 있어요, 가성비가 좋아요"
건대 숯불부자곱창,6.11.수,1,매장이 청결하고 맛있어요,"음식이 맛있어요, 고기 질이 좋아요, 양이 많아요, 특별한 메뉴가 있어요, 가성비가 좋아요"
건대 숯불부자곱창,5.30.금,1,사장님도 넘 친절하시고 맛있어요❤️,"음식이 맛있어요, 고기 질이 좋아요, 인테리어가 멋져요, 매장이 넓어요"
건대 숯불부자곱창,5.4.일,1,"아이랑 성수 핫플왔다가 건대까지 일부러 와서 들렀어요. 친절하시고 맛있고.. 오늘은 소곱창이지만 다음엔 양곱창 도전!!!
막창 좋아하는 중등과 오기 넘나 좋은곳입니다~♡","음식이 맛있어요, 고기 질이 좋아요, 가성비가 좋아요, 매장이 넓어요, 친절해요"
건대 숯불부자곱창,5.18.일,1,"메뉴시키면 느리게 나오는 편입니다.
모둠2개 25분 정도 걸렸습니다. 뚝배기가 각 테이블마다 있어서 저희는 안나온 것 같아 저 뚝배기는 뭐냐고 물어봤는데 알바분께서 급하게 메뉴가 조리중으로 나오는 중이라고 하시던데 주방이 보이는 저희로서는 아 잊고계셨구나 싶었습니다. 바쁘니 이해할 수 있지만 사과의 말씀 한마디 없이 콩나물국 주시면서 말씀하신게 이게 맞냐고 그냥 웃으며 얼버부리며 넘기시려는 모습이..후 불판 신경 안써주시고 감자부추 등 야채추가하면 다 꺼진 불판위에 가시던데 불이 안켜져요. 저 자리 불이 안켜져요ㅠㅠ 신경 좀 많이 써주세요 저희도 바쁜 종업원분들 붙잡고 물어보고 싶지 않습니다..
접기","매장이 넓어요, 오래 머무르기 좋아요"
건대 숯불부자곱창,5.27.화,1,"곱창 특유의 잡내도 안 나고 너무너무 맛있어요!
가게도 넓어서 원하는 자리에 편하게 앉을 수 있어요🙂
또 방문할게요!!!☺️","매장이 넓어요, 음식이 맛있어요, 특별한 메뉴가 있어요, 잡내가 적어요"
건대 숯불부자곱창,3.21.금,1,"막창이든 소곱창이든 잡내 하나없고
안에서 초벌해주고 환기도 잘되서 냄새도 잘 안납니다
간만에 가는 곱창집중 만족해용 ㅎㅎ","음식이 맛있어요, 잡내가 적어요, 매장이 넓어요, 친절해요, 직접 잘 구워줘요"
건대 숯불부자곱창,6.10.화,1,첫 방문인데 맛있습니다!! 직원분들도 친철하시고 재방문 의사 있습니다!!! 특히 곱창 너무 맛있네요🤩,"음식이 맛있어요, 고기 질이 좋아요, 인테리어가 멋져요, 매장이 넓어요, 친절해요"
건대 숯불부자곱창,5.11.일,1,"일단 저게 모둠 2인분입니다. 늦게가서 그런건가요? 인생 최악 곱창이네요 씹히지 않을만큼 막창은 질기고 곱창은 거의 반 건조된게 나오네요 .. 초벌해놓고 어디에 보관한걸 그냥 던져준느낌
곱창 먹다가 모래 처럼 씹히는게 있어서 보니 곱 찌꺼기(배설물) 인지 숯인지 탄건지 검정색도 나오고.. 다 뱉고 먹지도 않고 나왔습니다 돈 버렸네요
신경 좀 쓰고 장사해주세요",
건대 숯불부자곱창,5.7.수,1,"소곱창 먹었는데 잘 구워져서 나와서 좋아요. 직접 굽다보면 잘못 구워서 맛없기도 한데..
잘 먹었습니다.","음식이 맛있어요, 친절해요, 직접 잘 구워줘요"
건대 숯불부자곱창,3.14.금,1,"건대쪽에 올일 있어서 찾다가 리뷰 좋아서 들어왔는데
서울에서 먹은 곱창중에 젤 맛있어요~
곱창 다 구워져서 나와서 바로 먹을 수 있어서 좋아요 😀","음식이 맛있어요, 잡내가 적어요, 매장이 넓어요, 직접 잘 구워줘요"
건대 숯불부자곱창,5.3.토,1,"처음오는곳인데 여자친구가 환장을 하고 먹고있어요!
곱창과 대창의조합이 정말 맛있고
플레이팅까지 이쁘네요
눈과 입 둘다 만족입니다!
접기","음식이 맛있어요, 고기 질이 좋아요, 양이 많아요"
건대 숯불부자곱창,3.25.화,1,마늘 소곱창 진짜 진짜 맛있어요!! 다음에 또 오고싶은 맛..!! 진짜 기다리지도 않고 너무 맛닜게 먹었습니당,"매장이 넓어요, 친절해요, 매장이 청결해요, 음식이 맛있어요"
건대 숯불부자곱창,2.22.토,1,오랜만에 건대 데이트 후에~ 지난번에 우연히 방문했던 숯불부자곱창의 마늘 소곱창이 딱! 생각나고 먹고싶어서 재방문했어요❤️ 진짜 자신있게 시그니처고 한정으로 파는 이유를 알겠는 맛이니 꼭 다들 방문하세요🍺❤️❤️❤️❤️,"음식이 맛있어요, 고기 질이 좋아요, 잡내가 적어요"
건대 숯불부자곱창,1.26.일,1,"소곱창 러버인데 너무 맛있어요 자주 올거에여!!
맛있어서 둘이서 3인분 먹었네요ㅎㅎ
볶음밥도 맛도리👍🏻 매장도 넓고 구워서 나와서 딱좋고 기름기 쫙빠진맛이라 물리지도 않아여!!
자주 오겠습니다🤟🏻
접기","매장이 넓어요, 음식이 맛있어요, 친절해요, 매장이 청결해요, 직접 잘 구워줘요"
건대 숯불부자곱창,5.4.일,1,"맛있어용~~!!
주문하기 편하고 매장도 넓어요!
화장실도 안에 있어서 좋아요!","친절해요, 환기가 잘 돼요, 음식이 맛있어요, 매장이 넓어요"
건대 숯불부자곱창,6.6.금,1,친절하시구 좋아요! 음식은 말해뭐해요 ㅎㅎ 하나하나 웃으면서 응대해주셔서 좋은 기억 가지고 갑니다😊,"음식이 맛있어요, 고기 질이 좋아요, 매장이 넓어요, 단체모임 하기 좋아요, 친절해요"
건대 숯불부자곱창,5.9.금,1,마늘 소곱창 너무 맛있어요 가성비 좋아요 맛있게 먹고갑니다!,"매장이 넓어요, 단체모임 하기 좋아요, 음식이 맛있어요, 고기 질이 좋아요, 가성비가 좋아요"
건대 숯불부자곱창,4.27.일,1,"너무 깔끔하고 맛있고 금방 나와서 좋아요!!!
처음 와봤는데 가게도 음식도 깔끔하고 좋네요 만족♡","음식이 맛있어요, 고기 질이 좋아요, 뷰가 좋아요"
건대 숯불부자곱창,5.18.일,1,사장님과 직원분들이 너무 친절하시구 곱창 양도 많고 너무 맛있었어요! 다 구워서 나와서 먹기도 편했고 엄청 빨리 나와서 좋았어요! 다른 사이드 메뉴도 다 너무 맛있어서 자주 이용할 것 같아요 !,"음식이 맛있어요, 고기 질이 좋아요"
건대 숯불부자곱창,3.28.금,2,날씨가 살짝 추워서 뜨끗한 전골 곱창이 땡겨서 건대에 있는 부자곱창에 다녀왔어요. 뜨끗한 국물이 맛이 으뜸이고 고기도 너무 고소하고 구이와는 다르게 입 안에서 사르르 녹네요 정말 맛있게 먹엇습니다~!! 다음에 또 시간 내서 와서 전골 말고 소곱창도 먹고 싶네요~! 굿굿~,"음식이 맛있어요, 고기 질이 좋아요"
건대 숯불부자곱창,5.18.일,1,"매장에 손님이 반정도만 차 있었는데 주문하고 기본 25-30분 걸리더라구요. 제 주변 옆테이블 모두 하염없이 기다리다 다들 인상이 안좋아지기 시작했어요;; 저희것도 30분만에 나왔는데 맛이 실망..마늘곱창이라해서 마늘양념이 맛있게 된 줄 알았더니 마늘이 그냥 곱창안에 들어가있더라구요. 곱창 많이 질겼고 느끼한데 찍어먹을 맛있는 소스가 제대로 없었어요. 조금 먹다가 너무 질기고 맛이 없어서 먹는둥 마는둥 했답니다….;; 주변 테이블도 먹는데 표정이 정말 안좋아보였어요. 악의적인 리뷰 절대 아니고 여긴 경영을 대대적으로 바꾸셔야할듯요…
볶음밥이라도 먹자하고 시킬려니 밥이없어서 볶음밥이 주문이 안되더라구요. 너무 느끼해서 밥이라도 먹으려고 했더니.. 볶음밥 시간 오래걸려서 막아둔 것 같았어요.
접기",매장이 넓어요
