식당명,작성일,방문횟수,리뷰 내용,리뷰 태그,방문자 유형
노스 성수점,6.4.수,1,"부부끼리 오붓하게 데이트 갔어요.
성수동 핫한 레스토랑이라고 해서 갔는데 생각보다 더 핫플이어서 오래간만에 데이트 재미있게 했습니다 ^^
모든 메뉴가 다 맛있어 보였는데 치즈감자채전은 진짜 퓨전 피자로 너무 맛있었어요.
마무리로 들기름 아이스크림도 정말 좋았어요 ^^
접기","음식이 맛있어요, 비싼 만큼 가치있어요, 인테리어가 멋져요, 친절해요, 특별한 날 가기 좋아요",저녁에 방문
노스 성수점,5.26.월,1,"미국에서 온 친구와 딸과 함께 예약하고 다녀왔습니다. 살짝 매콤한 오일소스 참나물파스타, 조금 단맛나는 크림소스 소불고기파스타, 수란이 올려진 목살필라프, 그리고 두툼하고 감자채가 바삭한 꽤 양이 많은 치즈감자채전 모두 맛있게 잘 먹었습니다.","음식이 맛있어요, 특별한 메뉴가 있어요, 인테리어가 멋져요, 매장이 넓어요, 친절해요",저녁에 방문
노스 성수점,6.6.금,1,"직원분들 넘 친절하시고 음식도 진짜 맛있어요! 감자채 바삭바삭해서 식감도 좋고, 치즈 듬뿍에 상큼한 토마토소스 맛없없 조합이라 최고입니다ㅎㅎ 참나물 파스타도 깔끔한 오일파스타라 맛있었고 들기름 아이스크림도 달콤해서 넘 맛있었어요🥰👍👍 웨이팅할 가치가 있는 맛집입니다! 퓨전음식이라 독특한 메뉴가 정말 많더라구요~ 다음엔 다른 메뉴들도 먹어보고 싶어요ㅎㅎ 또 올게요!! 🐷🩷🩷","음식이 맛있어요, 특별한 메뉴가 있어요, 디저트가 맛있어요, 인테리어가 멋져요, 친절해요",점심에 방문
노스 성수점,5.9.금,1,"1)연어/차돌후토마끼 반줄 : 후토마끼답게 크기가 상당히 크고 연어/차돌, 계란, 새우튀김, 오이 등이 들어가 반개임에도 양이 많았음. 한입에 먹기는 힘들어서 나눠먹어야 하는게 좀 불편할 수 있음.
2) 깻잎페스토 파스타 : 깻잎으로 만든 페스토와 온센타마고를 함께 먹는 파스타로 파스타면이 일반면이 아닌 오레키에테 파스타면으로 약간 수제비 같은 느낌임. 면에 페스토가 적절하게 간이 배어있어서 맛있게 즐길 수 있었음.
3) 차돌알리올리오 : 고소한 차돌을 올린 알리올리오 파스타로 약간 느끼할 수 있는 알리올리오를 매콤함을 곁들여 물리지 않고 맛있게 먹을 수 있었음. 매운거를 잘 못먹는 사람들에겐 조금 매울 수 있으나 심심하지 않아서 좋았음.

벽에 걸린 휴지는 아쉬움. 음식에 먼지 날리고, 인테리어로 최악.
접기","음식이 맛있어요, 특별한 메뉴가 있어요, 메뉴 구성이 알차요, 컨셉이 독특해요",점심에 방문
노스 성수점,5.29.목,1,"치즈 감자채전 비슷한 메뉴 다른 곳에서도 먹어봤는데 여기가 가장 독보적인 것 같습니다. 치즈를 이렇게 듬뿍 넣어주시고, 폭신하게 재료들이 가득 들어가서 참 풍족했습니다. 토마토 소스까지 들어가서 마치 피자를 먹는 것 같은 기분이었어요. 채전 겉면에도 바닥에도 감자채가 바삭하게 들어가서 포카칩 먹는 맛도 났어요. 카다이프 떡볶이는 실타래 튀김이 떡을 감싸서 바삭하면서도 쫄깃했어요. 소스는 살짝만 매워서 부담이 없이 가볍게 먹을 수 있었습니다. 한식과 양식이 섞인 맛집이고, 인테리어는 한옥풍이라서 운치있었습니다.","음식이 맛있어요, 재료가 신선해요, 양이 많아요, 아늑해요, 야외공간이 멋져요",저녁에 방문
노스 성수점,5.28.수,1,성수동에서 한식 파스타 둘다 먹고 싶은 분들께 완전 강추하는 성수 맛집 노스 성수점입니다 치즈감자채전 치즈피자처럼 치즈왕창 들어가서 맛있어요 👍 칼비빔면도 새콤하면서 고소해서 비빔면 좋아하시면 추천합니다 👍👍👍,"음식이 맛있어요, 특별한 메뉴가 있어요, 메뉴 구성이 알차요, 인테리어가 멋져요, 사진이 잘 나와요",점심에 방문
노스 성수점,6.3.화,1,"카다이프떡볶이랑 파스타 먹었는데 조합이 좋았어요 🥰
다른 메뉴들도 맛있어보여서 또 오고싶어요!
휴일 기준 1:30분에 이미 재료소진, 웨이팅 마감이더라구요 🥹 저희는 네이버로 예약해서 다행히 잘다녀왔습니다 💚
테이블에 기본 냅킨과 물티슈 정도는 놓여져 있었으면 좋겠어요!
접기","아늑해요, 음식이 맛있어요, 가성비가 좋아요",점심에 방문
노스 성수점,4.26.토,1,"매장 분위기 너무 좋고 음식이 너무 맛있어요.
3가지 다 맛있네요.감자채전은 피자같기도 하고
가지덥밥은 맛이 독특하면서 맛있어요.
사태칼국수의 사태는 쫄깃하면서 찔기지 않고
부드러우면서 부서지지 않게 익힘정도가 너무 좋아요.
칼국수에 배추맛은 더 좋아요.
직원들도 다들 친절하시고 너무 좋아요.
들기름아이스크림도 너무 맛있어요.
다음에는 다른것도 먹으러 와야겠네요
접기","음식이 맛있어요, 특별한 메뉴가 있어요, 인테리어가 멋져요, 친절해요, 매장이 청결해요",점심에 방문
노스 성수점,6.1.일,1,"아이들과 함께 방문했어요
감자채전 치즈 가득
너무 맛있게 먹었어요
겉바속촉
대부분 메뉴 다 맛있었는데
칼국수는 걍 그냥 그랬어요

메쉬 포테이토 부드럽고 맛있네요
접기","음식이 맛있어요, 재료가 신선해요, 양이 많아요, 특별한 메뉴가 있어요, 매장이 넓어요",저녁에 방문
노스 성수점,4.16.수,1,"예약없이 방문해서 밖에서 웨이팅 중이였는데 친절하신 직원분 덕분에 밖에서 떨면서 있지않았어요.
음식도 정갈하고 짬뽕탕은 엄청 깔끔했고 맵지 않아서 먹기 좋았어요ㅎㅎ👍🏻참나물파스타는 오일리하지만 참나물맛이 많이나고 고소했어요 항정살은 뭐 말모말모 입니다💗","음식이 맛있어요, 재료가 신선해요, 가성비가 좋아요, 친절해요, 매장이 청결해요",점심에 방문
노스 성수점,3.25.화,1,"퓨전한식.. 아니, 어쩌면 무국적요리. 예쁜 식당에서 예쁜 음식들을 먹었습니다. 그만큼 충분히 맛있었죠. 연무장길의 상향평준화된 가격대 평균에 맴도는 음식값은 충분히 만족할 만 했습니다. 제가 먹은 소불고기파스타는 사진 맨 앞자리를 채웠습니다. 하얀 크림파스타 곁에 바싹익혀진 불고기가 자리하니 느끼할 수 있던 무게감이 조금은 가볍게 느껴졌습니다. 인간은 어떻게든 먹고 살아가나 봅니다. 먹어야할 이유도 모른 채로 본능적으로 음식을 먹어대는 나의 모습을 오늘처럼 목격하곤 합니다. 먹어야 한다는 잔여물만이 속을 지배한다는 사실에 소스라치게 놀라지만 변하는 것은 없습니다. 미래에 대한 의식적 기대감은 없고 두려움이 지배적인 현재를 보면 이렇게 맛있는 음식을 먹는 것이 순간의 고통을 잊게하나봅니다","음식이 맛있어요, 특별한 메뉴가 있어요, 메뉴 구성이 알차요, 인테리어가 멋져요, 매장이 청결해요",점심에 방문
노스 성수점,6.6.금,1,"감자치즈전 너무 맛있고 양도 많아요. 서빙도 친절하고 안쪽에 살짝 분리된 공간이 있어서 예약방문하니, 그쪽으로 배치해주셔서 너무 좋았습니다. 수다떨기 최적!! 음식도 다 전부 맛있고 카다이프떡볶이도 소스자체가 넘 맛있었습니다. 논알콜 하이볼도 있고 역에서 위치도 가깝고 좋았습니다.","음식이 맛있어요, 양이 많아요, 매장이 넓어요",저녁에 방문
노스 성수점,5.18.일,1,"매장 분위기도 너무 좋고 예약시간보다 좀 일찍 도착했는데 바로 입장을 도와주셔서 좋았어요! 평소 먹어보지 못한 특별한 메뉴들이여서 완전 맛있게 먹었습니다,,😋 양도 완전 많아서 진짜 배 터지는 줄 알았어요🤣","음식이 맛있어요, 양이 많아요, 특별한 메뉴가 있어요, 인테리어가 멋져요, 친절해요",점심에 방문
노스 성수점,4.6.일,1,"특별한 메뉴에 사로잡혀서 방문했는데
넘 맛있어요💗
완전 식감 맛집이에요..
카다이프 떡볶이는 맛있게 달달하고
감자채전은 식감이 미쳤어요!
필라프도 첫입먹었을 때 눈이 휘둥그레해졌어요+..+
접기","친절해요, 매장이 청결해요, 음식이 맛있어요, 재료가 신선해요, 특별한 메뉴가 있어요",점심에 방문
노스 성수점,3.28.금,1,"치즈감자채전과 카다이프떡볶이 둘다 맛있다!
특히 치즈감자채전 치즈도 완전 많고 약간 매콤한 토마토소스와 넘 잘어울린다!
감자채전을 떡볶이 국물에 찍어먹는것도 굿~~!
직원분들도 친절하시다!
접기","음식이 맛있어요, 특별한 메뉴가 있어요, 매장이 넓어요, 친절해요",저녁에 방문
노스 성수점,3.15.토,1,바로입장해서 들어갔어요! 논알콜 하이볼이랑 떡볶이 불고기파스타 타코 시켰는데 둘이서 먹기딱좋은 양입니다! 떡볶이도 가래떡이여서 쫄깃바삭하고 불고기파스타 꾸덕하고 달달해요! 타코안에있는 소스랑 내용물도 너무 맛있어요! 다음에 또 올께요~❤️👍,"음식이 맛있어요, 재료가 신선해요, 매장이 넓어요",저녁에 방문
노스 성수점,5.27.화,1,"예약없이 갔는데 한자리 남아서 겟햇어요 !!!
양도 많고 맛잇엇는데 양이 너무 많아서 다 못먹고 남겻네요ㅠㅠ","음식이 맛있어요, 특별한 메뉴가 있어요, 친절해요",점심에 방문
노스 성수점,4.6.일,1,"지나갈때마다 와보고싶었는데 웨이팅이많아서 못오다 오늘 운좋게 일요일일찍이라 바로 들어왔어요!
불고기파스타는 꾸덕하구진하니 넘넘맛있고
항정살필라프도 맛있는데 파스타소스에 같이먹으니 더더 맛있어요
인테리어나 노래 분위기 다 맛집🫶🏻
접기","인테리어가 멋져요, 아늑해요, 대화하기 좋아요, 친절해요, 음식이 맛있어요",점심에 방문
노스 성수점,4.5.토,1,"진짜 맛있어요💗
가족끼리 왔는데 분위기도 너무 좋고 맛있어서 설거지했습니다ㅎㅎ
동생은 가지덮밥이 가장 맛있었다했고 저는 카다이프 떡볶이랑 참나물파스타가 제일 맛있었어요🤤

서빙해주신 남자분도 너무 친절하시고 다음에 또 오고싶어요🥰
접기","매장이 청결해요, 단체모임 하기 좋아요, 음식이 맛있어요, 특별한 메뉴가 있어요, 메뉴 구성이 알차요",점심에 방문
노스 성수점,5.24.토,1,"음식들이 하나같이 예술작품마냥 너무너무 예뻤어요~
눈 호강 입호강 잘 하구 갑니다~ 번창하세요❤️","음식이 맛있어요, 재료가 신선해요, 인테리어가 멋져요, 친절해요, 매장이 청결해요",점심에 방문
노스 성수점,3.18.화,1,"☑️카다이프떡볶이
☑️치즈감자채전
☑️가지덮밥
세 메뉴 다 너무너무 맛있어요👍🏻 여자 둘이서 욕심내서 메뉴 세개시키긴했지만 생각보다 양도 많아서 완전 만족!!!! 식당 분위기도 느좋..❤️
접기","음식이 맛있어요, 특별한 메뉴가 있어요, 메뉴 구성이 알차요, 친절해요, 인테리어가 멋져요",저녁에 방문
노스 성수점,3.29.토,1,"맛있게 잘 먹었어요!
떡볶이가 튀김처럼 바삭해서 떡볶이국물이랑 잘 어울렸어요. 맵지 않고 순해요.
항정살은 야들야들하고 생각보다 양이 넉넉합니다.
파스타는 마늘이 맵지않게 딱 좋게 조리됬고 참나물 향과도 잘 어울려요.(흔한 파슬리와는 다른 매력)
접기","음식이 맛있어요, 재료가 신선해요, 특별한 메뉴가 있어요, 매장이 넓어요, 아늑해요",점심에 방문
노스 성수점,4.16.수,1,"저번부터 오고 싶었는데 기회가 돼서 오게 되었어요맛있는 메뉴들이 많아서 취향 다른 친구들이랑도 나눠먹기 좋았습니당!! 특히 감자채전이 비주얼도 .. 맛도 최고에요
성구 데이트 올 일 있으면 또 오려구요 ㅎㅎ","음식이 맛있어요, 특별한 메뉴가 있어요, 메뉴 구성이 알차요, 인테리어가 멋져요, 아늑해요",점심에 방문
노스 성수점,4.11.금,1,"그저 그런 양식이 질렸다면 여기 강추임
한식파인 사람으로서 되게 차별점있는 음식점이었다
양식에 한식을 곁들인 그렇지만 한식도 잘하는!
오일파스타에 들어간 마늘쫑과 마늘이 느끼함을 다 잡아줘서 근래 먹어본 음식점 중에서 내 기준 탑
접기","음식이 맛있어요, 재료가 신선해요, 특별한 메뉴가 있어요, 인테리어가 멋져요",저녁에 방문
노스 성수점,3.1.토,1,"진짜 너무너무너무 좋아요! 한식 러버로써 이곳은 그냥 지나칠 수가 없는 곳이에요.
같이 간 친구도 저도 재방문의사200% 라고 입을 모아 말했던 곳입니다!
예약 못했지만 오픈 시간 맞춰서 가니까 바로 입장 가능했어요. 분위기도 좋고 친절하십니다. 치즈감자채전 꼭 드세요","인테리어가 멋져요, 매장이 넓어요, 음식이 맛있어요, 양이 많아요, 특별한 메뉴가 있어요",점심에 방문
노스 성수점,5.30.금,1,노스 추천해요~. 요기 치즈 감자전이 아니라 피자네요~. 양 엄청 많아서 남겼습니다~. 미나리 파스타도 가지덮밥도 맛났습니다. 주위 보니 떡볶이와 치즈 감자전을 제일 많이 오더했도라구요. 담엔 저희도 이 조합 시켜보려구요~. 스텝 분들도 친절하셨어요!,"친절해요, 음식이 맛있어요, 특별한 메뉴가 있어요, 뷰가 좋아요",점심에 방문
노스 성수점,4.5.토,1,카다이프 떡볶이 약간 떡과튀김을 한번에 즐길수있고 달달하니 맵지않고 느끼하지않아 맛있어요! 감자채전 양 엄청 많아요🥺 약간 피자느낌! 여럿이서 오면 다양한 메뉴를 먹어볼수있고 좋을것같아요!,"음식이 맛있어요, 양이 많아요, 특별한 메뉴가 있어요, 인테리어가 멋져요, 친절해요",점심에 방문
노스 성수점,3.15.토,1,"어디서도 먹을 수 없는 특별한 메뉴가 가득한곳!
가래떡에 카다이프가 감아져있어서 바삭,쫀득해요.맵찔이인데 하나도 안 맵습니다.
감자채전은 두툼한데 바삭하면서도 안에 치즈가 들어있어서 맛나요!
한국적이면서도 너무 한국적이지만은 않은, 퓨전한식과 양식이 섞여 있어서 외국인친구랑 오기에도 좋겠어요!
그리고, 인테리어도 조명이 은은하고 분위기 자체가 모던해서 너무 좋네요~!
접기","음식이 맛있어요, 재료가 신선해요, 특별한 메뉴가 있어요, 인테리어가 멋져요, 친절해요",저녁에 방문
노스 성수점,3.11.화,1,"한번씩 할것도 많고 조용히 있고 싶어서 혼밥하고 싶은 날이 생기는데 딱이었던 성수동 맛집 ㅎㅎㅎ
구석에 앉아서 조용히 밥먹으며 빡집중한 날!

기대안했던 타코가 진짜 맛있었고 고구마가 지인짜 꿀맛이라 꼭 추가하세요 맥주안주로 짱일듯
접기","음식이 맛있어요, 특별한 메뉴가 있어요, 친절해요, 인테리어가 멋져요, 혼밥하기 좋아요",점심에 방문
노스 성수점,4.24.목,1,"성수 맛집 검색하면서 알게 되어 왔는데 생각보다 훨씬 맛있고, 분위기도 좋고, 메뉴도 특이해서 마음에 들어요. 다음에는 다른 메뉴들도 도전하고 싶습니다🫶🏻","음식이 맛있어요, 특별한 메뉴가 있어요, 친절해요, 인테리어가 멋져요, 단체모임 하기 좋아요",저녁에 방문
노스 성수점,3.19.수,1,"그냥 데이트 코스로만 알고 있었는데 음식도 너무 잘하는 곳이었어요. 참나물파스타는 처음 먹어보는 데 향긋하니, 봄에 꼭 먹어야할 것 같았어요!! 항정살필라프는 항정살이 다한…🙌 예약하고 방문했더니, 웨이팅도 없던..! 외국인 분들 엄청 많던데, 외국인들이 오면 너무 좋아할 듯","음식이 맛있어요, 재료가 신선해요, 메뉴 구성이 알차요, 단체모임 하기 좋아요, 아늑해요",저녁에 방문
노스 성수점,5.24.토,1,"떡볶이 강추입니다. 감자채전은 좀 느끼해요ㅠㅠ 근데 3시에 첫 음식이 나왔는데 3시 30분에 나가달라고 하셔서 좀 당황스러웟어요.. 음식 맛은 있었지만 요리시간이 너무 오래걸리고 브레이킹 시간 관련해서는 조치가 필요할 것 같아요
원래 리뷰 잘 안남기는데 이 부분은 보완이 필요한 것 같아서 리뷰남깁니다",음식이 맛있어요,점심에 방문
노스 성수점,3.28.금,1,"우선 공간이 너무 마음에 들어요. 인테리어가 너무 깔끔하고 예뻐서 머무는 시간 동안 기분이 좋았어요 ! 데이트나 특별한 날 오기 좋을 거 같네요…!
시킨 메뉴 중에서는 가지덮밥을 제일 맛있게 먹었습니다 🌝","음식이 맛있어요, 인테리어가 멋져요, 매장이 넓어요",점심에 방문
노스 성수점,4.23.수,2,친구추천으로 알게되서 저만의 또간집이 된곳입니다. 성수에 위치한것치고는 가격도 적당하고 음식도 정갈하고 맛있습니다. 가장 좋은점은 네이버에서 예약도 편하게 가능한점이 직장인들에게 편한것 같습니다.,"음식이 맛있어요, 특별한 메뉴가 있어요, 인테리어가 멋져요, 매장이 넓어요",저녁에 방문
노스 성수점,5.3.토,1,"부모님 모시고 왔는데 색다른 메뉴들과 예쁜 인테리어에 정말 만족해하셨습니다. 양도 많고 너무 맛있어서 행복한 식사시간이었습니다! 직원분들도 너무 친절하셔서 좋아요~~
감자전 강추합니다! 참나물 파스타와 치킨타코도 아주 맛있어요~~~","음식이 맛있어요, 양이 많아요, 특별한 메뉴가 있어요, 인테리어가 멋져요, 친절해요",점심에 방문
노스 성수점,4.17.목,1,"가지 덮밥과 감자체전 시켰습니다! 남자친구랑 데이트 했는데 저희 둘 다 너무 맛있게 먹었어요 💕 또 리뷰 이벤트로 주신 들기름 아이스크림도 너무 맛있었습니다ㅎㅎ. 오늘 데이트를 행복하게 마치는, 맛있는 저녁식사를 할 수 있어서 좋았습니다!","음식이 맛있어요, 특별한 메뉴가 있어요, 반찬이 잘 나와요, 인테리어가 멋져요, 혼밥하기 좋아요",저녁에 방문
노스 성수점,3.14.금,1,"금요일 저녁이라 예약 후에 방문했습니다 😊
일단 식당 분위기가 너무 좋고 깔끔해요
소개팅이나 데이트 코스로 딱입니다 ㅎㅎ
음식은 타코랑 항정살 필라프 시켰는데
타코도 딱 간이 적당하고 필라프도 항정살과 반숙 그리고 마늘의 조화가 잘 이루어져서 정말 맛있게 먹었어요 😍
다음에 방문하면 다른 음식도 먹어보고 싶네요
접기","음식이 맛있어요, 특별한 메뉴가 있어요, 인테리어가 멋져요, 아늑해요, 친절해요",저녁에 방문
노스 성수점,4.16.수,1,충격적인 맛이에요! 특히 가지덮밥~ 첫입먹고 이건뭐지?? 했답니다! 근래 먹은 음식중 제일 맛있었어요. 건강한데 맛있는 맛! 참나물 파스타도 봄냄새 가득하고 딱 원하는 간으로 맛있었어요 또 올게요 번창하세요 사장님~~,"음식이 맛있어요, 가성비가 좋아요, 인테리어가 멋져요, 매장이 넓어요, 친절해요",저녁에 방문
노스 성수점,3.30.일,1,"분위기좋고 매장이 깔끔해요! 캐치테이블 예약 추천🙂
치즈감자채전 양이 많고 치즈도 듬뿍 들어가있네요
소불고기파스타도 맛있어요👍🏻","재료가 신선해요, 특별한 메뉴가 있어요, 인테리어가 멋져요, 매장이 넓어요",점심에 방문
노스 성수점,4.25.금,1,예약시간보다 한시간 반이나 빨리 도착했는데 자리 나는데로 안내해주셔서 너무 감사했어요~ 직원분들도 전부 친절하시고 매장도 생각보다 넓어요! 음식양은 작다고 들었는데 둘다 튀긴거로 주문해서 그런지 둘이서 먹었는데 완전 배불렀어요 재방문 의사 있습니다^^,"음식이 맛있어요, 특별한 메뉴가 있어요, 가성비가 좋아요, 인테리어가 멋져요, 매장이 넓어요",저녁에 방문
노스 성수점,3.24.월,1,"카다이프 떡볶이, 치즈감자채전, 항정살필라프 시켰어용
떡볶이는 누구나 좋아할 분식집 느낌에 바쟉한 카다이프가 떡에 둘러져 있어서 맛있어여
항정살필라프는 마늘쫑이 같이 들어가있어서 향이 좋고 맛있습니당
치즈감자채전이 개지리는데 그냥 치즈 먹는 느낌일 정도로 치즈가 개ㅐㅐㅐㅐㅣ많아요
전체적으로 다 맛있어여
접기","음식이 맛있어요, 양이 많아요, 특별한 메뉴가 있어요, 매장이 넓어요, 뷰가 좋아요",점심에 방문
노스 성수점,4.5.토,1,"일하시는 분들이 너무 친절하시고, 음식도 너무 맛있어요🫢

카다이프 떡볶이, 들기름 아이스크림 등등 다른 곳에서는 보기 힘든 다양한 음식들이 많아서 신기했어요!

인테리어랑 분위기도 너무 좋아서 친구, 연인들이랑 기분 내러 오기 너무 좋을 것 같아요! 성수에 온다면 꼭 들려야 할 곳 입니다~!
접기","음식이 맛있어요, 특별한 메뉴가 있어요, 인테리어가 멋져요, 친절해요",점심에 방문
노스 성수점,3.8.토,1,"분위기도 좋고 5시 브레이크 타임 끝나자마자
시간 맞춰 왔는데 거의 바로 들어갔어요-!

가지덮밥 가지보단 고기가 많고 조금 많이 매콤했지만
맛있었어요 ㅎㅎ

항정살은 조금더 따듯했으면 더 맛있었을것 같아요-!

분위기가 좋아서 데이트하시기도 좋을것 같습니다 ㅎ
접기","인테리어가 멋져요, 음식이 맛있어요, 양이 많아요, 가성비가 좋아요",저녁에 방문
노스 성수점,3.8.토,1,"퓨전 한식 답게 독특한 메뉴들이 색다르고 너무 맛있어요~
특히 테이블마다 빠지지 않고 주문된 치즈감자채전은 이름은 전인데 뉴욕피자를 먹는듯한 느낌이 들 정도로 치즈가 엄청나고 맛있어서 너무 만족스러웠습니다.
다른 메뉴들도 먹어보고 싶어서 또 방문하겠습니다.","음식이 맛있어요, 특별한 메뉴가 있어요, 인테리어가 멋져요, 친절해요, 매장이 청결해요",점심에 방문
노스 성수점,4.16.수,1,"생일기념 데이트로 남편이랑 방문했습니다. 너무 맛있고, 분위기도 좋아요! 직원분들도 친절하셔요:) 딱 한가지 아쉬운게 있다면 나무 의자라 엉덩이가 너무 아파요...🥲🫠","음식이 맛있어요, 매장이 넓어요, 인테리어가 멋져요",저녁에 방문
노스 성수점,4.21.월,2,"짬뽕밥 뭔가 특이하고 맛있네요😋
항정필라프는 완전 걍츄함니다…. 맛있어요 귯","인테리어가 멋져요, 음식이 맛있어요, 양이 많아요",저녁에 방문
노스 성수점,3.29.토,1,"친구랑 성수 나들이왔는데 며칠전부터 맛집을 찾는다했더니 발견한 식당,, 사진부터 너무 맛있어보여서 가자고했는데 도착해보니 외관부터 너무 건물이 예뻤어요 메뉴판에 사진이있어서 음식고를때 너무 힘들었어요.. 다ㅠ맛있어보여서..🤤 직원분들 너무 친절하게 응대해주셨고 내부 인터리어도 너무 좋았어요 따뜻하고 아늑한느낌 노래도 너무 잔잔하고 시끄럽지않아 좋았고 음식도 너무 맛있었어요! 퓨전이라 더 색다른느낌이였고 분위기가 너무 좋았던..✨","음식이 맛있어요, 재료가 신선해요, 인테리어가 멋져요, 친절해요, 매장이 청결해요",점심에 방문
노스 성수점,1.24.금,1,"✍️성수동 직장인 점심후기
- 항정살 필라프

- 평일 오전 11시 30분 방문
- 웨이팅 없음
- 다채로운 퓨전 한식메뉴
- 메뉴, 맛대비 가성비 좋음
- 기본찬 2종(칠리페퍼, 백김치)
- 공간이 넓고 좌석이 많아요

점심이나 저녁에 한잔하러
또 방문하고 싶은 밥집입니다

⚠️
단, 느끼한거 잘 못드시는 분이라면
항정살 필라프 외의 메뉴를 추천드려요
통통한 버섯과 항정살이 맛있었지만
반쯤 먹다보면 상당히 느끼해져서
점심부터 생맥주 땡기는거 참느라 힘들었네요

저보다 느끼한것을 잘먹는 다른동료의견도
동일했어요 🍺🍺🍺🍺🍺

(고기부위 자체도 기름기가 많은부위인데
밥도 기름진편이라 그런듯해요🙂‍↕️...)
중간에 직원분께 피클요청드렸고
챙겨주신덕분에 남기지않고 잘먹었습니다
감사합니다~

🤑내돈내산
접기","음식이 맛있어요, 특별한 메뉴가 있어요, 가성비가 좋아요, 인테리어가 멋져요, 매장이 넓어요",점심에 방문
