식당명,작성일,방문횟수,리뷰 내용,리뷰 태그,방문자 유형
도쿄빙수 건대점,5.29.목,1,"빙수의 계절이라 도쿄빙수는 처음 가 봤는데 아늑한 분위기에 빙수도 맛있었다. 색다른 빙수가 다양한 종류로 있었다. 토마토, 참외, 복숭아, 애플망고, 녹차 빙수 등이 있어서 다음에는 다른 맛으로 즐겨도 좋을 듯하다.","특별한 메뉴가 있어요, 디저트가 맛있어요, 인테리어가 멋져요, 대화하기 좋아요, 아늑해요",아침에 방문
도쿄빙수 건대점,6.8.일,1,"올해는 자두가 없어서 아쉽지만 참외랑 토마토 둘 다 맛있었어용
근데 토마토가 더 맛있으니 둘 중 고민한다면 토마토 추천합니다","가성비가 좋아요, 디저트가 맛있어요, 아늑해요, 차분한 분위기에요",점심에 방문
도쿄빙수 건대점,5.13.화,1,"토마토빙수에 후추가 뿌려져 있어서 처음엔 이게뭔가..하고 낯설었지만, 생각보다 잘 어울렸습니다. 새콤달콤한 토마토와 부드럽고 시원한 얼음이 깔끔하게 어울렸어요
후추 덕분에 맛이 심심하지 않고 은근한 포인트가 있었어요.
가게 직원분들도 친절합니다
색다른 디저트를 좋아하는 분들께 한 번쯤 추천하고 싶은 메뉴입니다.
접기","디저트가 맛있어요, 사진이 잘 나와요, 친절해요, 매장이 청결해요, 화장실이 깨끗해요",아침에 방문
도쿄빙수 건대점,5.2.금,1,토마토빙수라 으잉?햇는데 은근 달달하니 잘 어울리네요ㅋㅋ 글고 토스트가 진짜 존맛ㅋㅋ 커피땡기는 맛이에용,"특별한 메뉴가 있어요, 디저트가 맛있어요, 친절해요",아침에 방문
도쿄빙수 건대점,6.10.화,1,항상 도쿄빙수 가보고 싶었는데 드디어 소원 성취했습니다! 망고도 쫄깃해서 완전 달달하게 디저트 처리하고 왔슴다 🍨,"특별한 메뉴가 있어요, 가성비가 좋아요, 디저트가 맛있어요",저녁에 방문
도쿄빙수 건대점,5.24.토,1,"토마토 빙수는 말모~ 🍅
토스트 존맛탱 여기 토스트 맛집🍞",디저트가 맛있어요,아침에 방문
도쿄빙수 건대점,5.15.목,1,건대 올때마다 항상오는 빙수집! 망고빙수 존맛이욤~~😚😚,"커피가 맛있어요, 음료가 맛있어요, 특별한 메뉴가 있어요",저녁에 방문
도쿄빙수 건대점,5.18.일,1,토마토 빙수가 너무맛잇어욤~또올게요!,"대화하기 좋아요, 가성비가 좋아요, 디저트가 맛있어요, 양이 많아요, 음식이 맛있어요",저녁에 방문
도쿄빙수 건대점,4.15.화,1,딸기마스카포네빙수 먹었어용!!🍓 토마토만 먹어봤는데 딸기도 넘 달달상큼해서 좋고❤️ 마스카포네치즈가 아주 부드럽구 뽀인트로 짱🥰🍧🍧 건대오면 도쿄빙수가기 메모~📝,"아늑해요, 친절해요, 매장이 청결해요, 디저트가 맛있어요, 재료가 신선해요",저녁에 방문
도쿄빙수 건대점,1.27.월,1,아주 맛있어요! 마스카포네가 아주 잘어울립니다. 떡도 쫀득하고 맛있었어요!,"특별한 메뉴가 있어요, 디저트가 맛있어요",점심에 방문
도쿄빙수 건대점,3.10.월,1,토마토빙수🍅✨,특별한 메뉴가 있어요,점심에 방문
도쿄빙수 건대점,2.2.일,1,딸기빙수 맛있고 재료도 신선하고 직원분도 친절하세요,"음료가 맛있어요, 디저트가 맛있어요, 인테리어가 멋져요, 친절해요, 매장이 청결해요",점심에 방문
도쿄빙수 건대점,1.12.일,1,너무 이쁘고 맛도 좋아요 😄,"특별한 메뉴가 있어요, 디저트가 맛있어요, 인테리어가 멋져요, 사진이 잘 나와요, 대화하기 좋아요",밤에 방문
도쿄빙수 건대점,24.10.5.토,1,"유행할때안먹어보고 유행다지나고 먹어본 도쿄빙수!
달달한 단호박죽 맛 토핑이 올라가있어서 맛있게먹었어요!
안에도 한층더 있어서 끝까지맛있게 냠

단점: 그릇 너무 작아서 질질흘리고먹을수밖에
접기","특별한 메뉴가 있어요, 디저트가 맛있어요",점심에 방문
도쿄빙수 건대점,24.12.10.화,1,1년 전에도 왔었는데 너무 맛있어요!! 가게에 마지막 남았는데 서비스로 에그타르트도 주시고 😍😍 다음에 또 올게요~~!,"차분한 분위기에요, 가성비가 좋아요, 디저트가 맛있어요, 건강한 맛이에요, 음식이 맛있어요",저녁에 방문
도쿄빙수 건대점,24.11.13.수,1,"매장 들어가서 눈마주쳐도 인사 없음
그리고 분명 10시까지 영업시간으로 표기돼있는데...
9시 넘어가면서부터 엄청 쾅쾅 의자 책상 드르륵 치우시고
손님들 문열고 들어오자마자 “저희 영업 끝났어요!”
9시 4x분쯤 카운터에 서서 영업 종료라고 소리치심.. 음.. 😟
접기",,저녁에 방문
도쿄빙수 건대점,24.12.13.금,1,"토마토, 피스타치오 등 독특하고 맛난 빙수가 있어요","매장이 청결해요, 특별한 메뉴가 있어요, 디저트가 맛있어요, 음식이 맛있어요, 아늑해요",저녁에 방문
도쿄빙수 건대점,24.12.9.월,1,도쿄빙수 토마토빙수 너무 좋아요,"음료가 맛있어요, 특별한 메뉴가 있어요, 가성비가 좋아요, 디저트가 맛있어요, 건강한 맛이에요",저녁에 방문
도쿄빙수 건대점,2.28.금,2,,디저트가 맛있어요,저녁에 방문
도쿄빙수 건대점,24.8.24.토,1,"도쿄빙수 먹어보고싶었어서 들려봤어요!!

다행히 웨이팅 없이 들어갈 수 있었는데 먹다보니 토요일 오후라 그런지 점점 사람들이 많이 들어오더라구요!

자두 빙수 먹어보고싶었는데 시즌이 끝나서 아쉬웠지만 ㅠ.ㅠ 또 다른 시즌메뉴인 복숭아 빙수 먹었어요-♡ 🍑

복숭아를 워낙에 좋아해서 넘넘 맛있었구, 그냥 물얼음일 줄 알았는데 우유 얼음이라 더 맛있었어요!! 🧊 🍨 ❤️
접기","특별한 메뉴가 있어요, 디저트가 맛있어요",점심에 방문
도쿄빙수 건대점,24.8.18.일,1,오랜만에 빙수가 먹고 싶어서 요즘 나름 핫하다는 도쿄빙수 갔어요 애매한 시간이라 생각하고 갔으나 사람이 많아 바 자리에 앉았어요 빙수는 뭐 평타정도는 합니다 다만 기대했던 프렌치토스트는 나오는데 시간도 오래 걸리고 전자렌지에다가 조리를 하던데 그런줄 알았으면 안 시켰을꺼예요 좀 많이 아쉬었어요,,점심에 방문
도쿄빙수 건대점,24.11.19.화,1,"토마토 빙수 너무 맛있어요ㅠㅠㅠ
추운 날 먹어도 맛있다는","친절해요, 매장이 청결해요, 특별한 메뉴가 있어요, 디저트가 맛있어요, 건강한 맛이에요",저녁에 방문
도쿄빙수 건대점,24.7.25.목,1,도쿄빙수 궁금해서 가봤어요. 요즘 핫한 피스타치오로 빙수가 있길래 먹어봤는데...음..전 불호스타일이네요.ㅠ 피스타치오가루가 모래같은 식감이라 모래빙수를 먹는 느낌?ㅋ 낮은 그릇에 봉긋하게 솟은 모양이라 무너지지 않게 퍼먹는 재미는 있었네요~,"특별한 메뉴가 있어요, 대화하기 좋아요, 매장이 청결해요",점심에 방문
도쿄빙수 건대점,24.9.18.수,1,"도쿄 녹차 빙수 입니다.

존맛탱 입니다!","특별한 메뉴가 있어요, 메뉴 구성이 알차요, 컨셉이 독특해요",점심에 방문
도쿄빙수 건대점,24.8.10.토,1,피스타치오 빙수 먹었는데 꼬소한 맛이에요. 뭔가 우유 얼음과 물 얼음 반반인 느낌이라 시원함이 큰 빙수에여~! 가격 대비 양이나 고명이 좀 아쉬운 느낌입니다.,디저트가 맛있어요,저녁에 방문
도쿄빙수 건대점,24.8.28.수,1,"거으이 10년? 전쯤 이 토마토 후추 빙수 먹으러 친구랑 왔던 기억이 있는데 여전히 같은 맛 같은 가게라 반갑고 정겨웠어요.
가게마다 후추를 셀프로 뿌리던데 여기는 직접 뿌려주시는 듯.
얼음 안쪽에도 토마토 퓨레가 더 있으면 좋을텐데 그건 좀 아쉽고.. 그릇이 너무 작아져서 ㅎㅎㅎ 흘리고 먹기가 힘들긴하지만 맛은 좋음.
가끔 생각남..
접기","특별한 메뉴가 있어요, 디저트가 맛있어요, 음식이 맛있어요, 친절해요",저녁에 방문
도쿄빙수 건대점,24.6.16.일,1,"ᴍ ᴇ ɴ ᴜ 방울방울토마토(11900) + 애플망고(13000) /

토마토빙수!! 진짜 진짜 맛있어요~~
옛날 토마토마 아이스크림 맛이랑 비슷한 거 같아요!
향긋한 토마토 그 자체입니당,, 강추ㅠ 은은한 단맛이 너무 맛있어요

애플망고빙수도 달달하니 맛있었어요!! 얼음 안쪽에도 과일이 들어있더라구요! 굳굳

모찌는 신메뉴라고 서비스로 주셨는데 떡 쫀득하고 안에 단팥이랑 견과류 들어있는데 얘두 맛나요

하지만 저의 강력원픽은 토마토빙수입니다••♡
접기","대화하기 좋아요, 특별한 메뉴가 있어요, 가성비가 좋아요, 디저트가 맛있어요, 친절해요",저녁에 방문
도쿄빙수 건대점,24.8.10.토,1,"애플망고 1.3 피스타치오 1.39
둘 다 다른 결로 정말 맛있다. 찐 본연의 맛이 났던 두 빙수. 완전 추천. 집 근처라면 혼자라도 와서 먹고싶.",특별한 메뉴가 있어요,저녁에 방문
도쿄빙수 건대점,24.9.28.토,1,토마토 빙수 되게 독특하다고 생각했는데 맛도 있어요! 잘 알고 있는 생토마토맛인데 우유빙수랑 엄청 잘어울리는... 후추도 너무 잘 어울리네요 ㅎㅎ,"특별한 메뉴가 있어요, 디저트가 맛있어요",점심에 방문
도쿄빙수 건대점,24.7.19.금,1,"방울방울토빙🍅🍧❤️
토달밥먹고 토빙 먹으러왔어용 일명 토마토코스🍅
설빙만 먹어온 제게 도쿄빙수는 “아 이런 빙수도 맛있찌” 하면소 일깨워 주는 맛 !!!!🤣
생각나면 또 먹으러 올거에용
접기","특별한 메뉴가 있어요, 디저트가 맛있어요",저녁에 방문
도쿄빙수 건대점,24.8.28.수,1,도쿄빙수에서 시그니처인 토마토빙수를 먹었어요 ㅎㅎ 여전히 맛있고 여름철에 먹기 딱 좋은 것 같습니다 ! 겉에 조금 뿌려진 후추도 잘 어울립니다 !!,"친절해요, 매장이 청결해요, 특별한 메뉴가 있어요, 디저트가 맛있어요, 아늑해요",저녁에 방문
도쿄빙수 건대점,2.22.토,1,굿,디저트가 맛있어요,저녁에 방문
도쿄빙수 건대점,24.9.19.목,1,재방문했어요 여전히 맛있어요 ~! ! 좀 흐르긴 했지만 괜차나여,디저트가 맛있어요,저녁에 방문
도쿄빙수 건대점,24.8.21.수,1,"망고빙수 너무 맛있게 먹었어요
생망고가 올라간 빙수는 아니지만 전혀 아쉽지 않음
근데 그릇은 왜이렇게 작은데 담아 주는지 ㅎㅎ
소스가 줄줄 흘러서 아까워요
접기","가성비가 좋아요, 디저트가 맛있어요",점심에 방문
도쿄빙수 건대점,24.7.29.월,1,"동생이 너무 맛있다며 좋아했어요🫶🏻
귀여운 토마토 빙수 추천!","대화하기 좋아요, 특별한 메뉴가 있어요, 디저트가 맛있어요",저녁에 방문
도쿄빙수 건대점,24.7.24.수,1,토마토 빙수가 정말 달달하고 맛있어요!,"커피가 맛있어요, 음료가 맛있어요, 디저트가 맛있어요, 인테리어가 멋져요",저녁에 방문
도쿄빙수 건대점,24.7.30.화,1,거의 10년만에 방문했는데 여전히 맛있네요!! 그때는 토마토빙수만 먹었는데 이번에 처음으로 애플망고빙수 먹어봤어욤 ㅎㅎ 이것도 참 맛있네용!!!,디저트가 맛있어요,점심에 방문
도쿄빙수 건대점,24.8.27.화,1,"빙수 커피도 너무 맛있어요^^
다음에 또 갈게요♡","커피가 맛있어요, 특별한 메뉴가 있어요",점심에 방문
도쿄빙수 건대점,24.6.16.일,1,"가게문을 열자마자 코끝을 쏘는 레몬 향기에 안시킬수 없었어요🍋 비주얼 너어어어무 이쁘구 위에 넉넉히 올려주신 애플민트 쪽쪽 찢어서 섞어먹으니 천국 그 자체

오후 1시넘어가니까 금방 만석되더라구요 빠르게 맛점하고 오시길 추천드립니다! 매장도 시원하고 빙수맛집이라 회전은 빨라보이긴했어요","디저트가 맛있어요, 친절해요, 매장이 청결해요, 사진이 잘 나와요, 대화하기 좋아요",점심에 방문
도쿄빙수 건대점,24.11.3.일,1,🤩,커피가 맛있어요,저녁에 방문
도쿄빙수 건대점,24.8.18.일,1,"친절한것은 정말 인정..
그러나 평균10~30분 기다려서 먹어야할
특별함이 없고 맛도 솔직히..
진짜 솔직하게 맛과 양은 더 맛있는곳
많고 더 시원하고 넓고 의자 편한곳도
많다는 것..
접기",친절해요,점심에 방문
도쿄빙수 건대점,24.5.1.수,1,"새콤달콤 제주 레몬 빙수와 도쿄 후렌치토스트 시켰습니다
제주레몬 상큼달큼한 맛이고 우유얼음은 매우 부드러웠습니다. 도쿄 후렌치토스트는 예전에 먹전 허니버터브레드 같은 느낌이었는데 많이 달지 않고 빵이 퐁신해서 잘 먹었습니다",디저트가 맛있어요,저녁에 방문
도쿄빙수 건대점,24.9.19.목,1,맛있어요~ 잘 흘릴 수 있으니 주의해서 먹어야해요!,디저트가 맛있어요,저녁에 방문
도쿄빙수 건대점,24.6.15.토,1,"딸과 디저트먹기
의외로 손님이 계속 들어오는걸 보고
살짝 놀람 망고빙수가 인기 인기인듯
보였다
접기",디저트가 맛있어요,밤에 방문
도쿄빙수 건대점,24.6.23.일,1,말차 빙수 먹어 본 중 젤 맛난 곳이에요! 또 생각나는 곳입니다!,"사진이 잘 나와요, 디저트가 맛있어요, 메뉴 구성이 알차요",점심에 방문
도쿄빙수 건대점,24.7.18.목,1,"맛은 그냥 ....
매장 상당히 시끄럽습니다
시끄럽습니다 대화 하실분들은 다른곳 추천드려요",특별한 메뉴가 있어요,저녁에 방문
도쿄빙수 건대점,24.8.2.금,1,우유빙수가 맛있어요! 토마토 조금만 더 들어가면 좋겠다는 개인적인 바람과 아쉬움... 그래도 우유빙수 자체가 맛있어서 잘 먹었습니다. 양은 조금 아쉽?,디저트가 맛있어요,점심에 방문
도쿄빙수 건대점,24.8.19.월,1,"토매토우 빙수 진짜 맛도리.
건대 오면 빙수 무조건 도쿄빙수로 갑니당
근데 안에 좀만 덜춥게 해줬으면좋겠음.","특별한 메뉴가 있어요, 디저트가 맛있어요",저녁에 방문
도쿄빙수 건대점,24.7.26.금,1,시즌한정 자두빙수 먹었는데 신선하고 달달해서 맛있어요~,"특별한 메뉴가 있어요, 가성비가 좋아요, 디저트가 맛있어요, 건강한 맛이에요, 재료가 신선해요",저녁에 방문
도쿄빙수 건대점,24.7.17.수,1,빙수 예쁘게 생김,"특별한 메뉴가 있어요, 디저트가 맛있어요",저녁에 방문
