식당명,작성일,방문횟수,리뷰 내용,리뷰 태그,방문자 유형
베통 성수 플래그십,4.5.토,1,"주말 오픈런 했는데 15분 정도 기다렸다가 입장했어요!
이미 그때는 초코 소금빵은 없었고, 기본 2 트러플 1 샀는데 기본적으로 엄청 묵직하고 부드러운 소금빵이에요!
속도 부드럽고 밀도가 되게 높은 느낌? 겉은 소금빵 손잡이 부분은 되게 빠작한데 두꺼운 가운데 부분은 바삭하진 않고 부드러워요! 경험해본 것으로 만족","디저트가 맛있어요, 친절해요, 매장이 청결해요",아침에 방문
베통 성수 플래그십,4.8.화,1,"성수하면 베통 , 베통하면 성수
앞전에 갔을땐 밖에서 사진만 찍고왔는데 ... 이번엔
빵을 사서먹어봤다.
성수유명소금빵집 있는데 그곳보다는 이곳이 한단계 위인게 맞는게 훨 부드럽고 덜 느끼하고 속초겉바삭 ~ 이면서 모양도 고급지고 맛도 고급지다.
더 특이했던건 이들만의 자부심인듯 보이는 신문 📰
정말 맘에 들었던게 전문가들이 추구하고 느끼는 그 무언가를 알고 있고, 자부심도 대단하다. 이점에서 더 신뢰감이 들고 , 자세한 설명서의 고급진 종이메신져가 다음호 내용이 더 궁금하게 만드는 거 같아 또 가고싶다.
물론, 다른 맛보지 못한 빵도 궁금하지요.
알고보니 다른지점도 있더군요.
다른지점 분위기도 궁금해지기 시작해서 투어를 해볼까 합니다.
바쁜와중에도
직원분들의 친절함 역시 잊을수가 없었어요.
강추강추
접기","특별한 메뉴가 있어요, 종류가 다양해요, 인테리어가 멋져요, 아늑해요, 친절해요",점심에 방문
베통 성수 플래그십,5.1.목,1,"베통 소금빵은 젤 좋아하는 곳 중 하나다.
다만 오피스상권이라 평일만 영업하고
빵이 금방 금방 솔드아웃됨이 맘이 아프다.
일부러 월자나 오전반차 내고 와도 아쉽지않고 뿌듯하다.
접기","음식이 맛있어요, 인테리어가 멋져요, 친절해요, 매장이 청결해요, 화장실이 깨끗해요",아침에 방문
베통 성수 플래그십,3.10.월,1,"귀여운 소금빵! 역삼점으로 방문했는데 역시 오픈런해야 기본 소금빵라인들을 맘편히 즐길 수 있었어요.
빵 나오는 시간표랑 100프로 맞진않아 더티초코를 못먹은게 조금 아쉽 ㅠㅠ
그래두 겉바속쫀으로 느끼하지않고 담백해서 좋았음","디저트가 맛있어요, 특별한 메뉴가 있어요, 매장이 청결해요",아침에 방문
베통 성수 플래그십,3.3.월,1,진짜 너무 맛있어요 ; 소금빵 맛있고 일단 토마토 스프가 대박 미치심 ;; 먹어본 토마토스프중에 당연 1등이었고 토마토 싫어하는 제 친구도 너무 맛있대요 ㅠㅠ 그리고 직원분들 일하시는게 너무 열정적이어서 보기 너무 좋았어요ㅠㅡㅠ 빵에 진심인게 느껴져서 더 좋게 즐기다 올 수 있었어요 ! 성수가면 또 방문하고 싶은 카페 ..,"대화하기 좋아요, 아늑해요, 디저트가 맛있어요, 음료가 맛있어요, 특별한 메뉴가 있어요",저녁에 방문
베통 성수 플래그십,5.30.금,1,"🥐🥐은은하게 달달구리한 맛😁😋
솔티초코소금빵🍫
트러플소금빵🍄‍🟫
고르곤졸라치즈소금빵🧀
바질페스토소금빵🌿
그리고 기본!🥐
프레첼 같이 소다처리된 살짝 바삭딱딱한 식감이에요!
넓은 부분은 폭신고소하고 끝부분은 바사삭해요
기본 소금빵 외에는 전부 연유크림(?)살짝 마요느낌도 나는 각각의 베이스의 필링이 들어가 있습니다.
초코크림은 연유스럽지는 않았고
바질페스토, 트러플, 치즈는 연유 +각각의 맛이 느껴졌어요. 필링이 들어간 소금빵은 덜 바삭하고 버터향도 비교적 덜합니다.
전체적으로 달달 고소하고, 짭쪼름한 맛은 많이는 안느껴집니다.
(저는 개인적으로 더 버터리하고 더 바사삭했으먼 좋았을 것 같아요!)
다른 데 소금빵에 비해 크기가 많이 큰 것 같아요!
저는 재방문 의사는 없습니다♥️
직원분들이 엄청엄청 친절스윗하세요!
접기","디저트가 맛있어요, 특별한 메뉴가 있어요, 인테리어가 멋져요, 사진이 잘 나와요",점심에 방문
베통 성수 플래그십,3.15.토,1,"초코랑 패딩턴 샀어요
패딩턴은 오렌지마멜레이드에요!
기대를 엄청하고 갔는데 생각한 느낌과 평소먹던느낌이아니었어요 제가 먹던건 버터가득 겉바속촉인데 이건 빵이 밀도있는거같아요
커피는쓰지않고 보리커피같아요 빵이랑 먹기좋은거같아요 라떼부드러웠어요
그리고 친절하고 안내잘해주셔서좋아요!
화장실은 이층에 남녀각각있어여
접기","디저트가 맛있어요, 친절해요, 매장이 청결해요",아침에 방문
베통 성수 플래그십,1.27.월,1,"성수동에서 줄을 서야 막을수 있는 ""베통"" 드디어 맛을 봤습니다!! 소금빵에 대한 정성과 진심으로 빵을 만들어 내고 소금빵도 다양하고 맛있어서 즐기기 너무 좋아요!!
겉빠속촉은 기본!! 버터홀이 선명하고 다양한 소금빵 종류로 가분에 따라, 먹고싶은 맛에 따라 선택이 가능합니다. 포장도 좋지만 저는 40분을 기다려서 매장 안에서 커피와 함께 먹었는데요^^ 손님들 진짜 많고, 분위기도 좋았어요^^ 왜 줄 서서 먹는지를 알것 같은!!
지인들에게도 포장해서 같이 먹고싶고, 선물하고도 싶은 소금빵 맛집 분위기 좋은 데이트카페 ""베통"" 입니다.
접기","디저트가 맛있어요, 빵이 맛있어요, 아늑해요, 음악이 좋아요, 선물하기 좋아요",점심에 방문
